number,value,datetime_start,datetime_complete,duration,params_bagging_fraction,params_feature_fraction,params_lambda_l2,params_learning_rate,params_min_data_in_leaf,params_num_leaves,params_objective,user_attrs_best_iteration,state
0,0.18421936874997044,2026-09-27 21:56:44.889486,2026-09-27 21:57:37.247242,0 days 00:00:52.357756,0.5780093202212182,0.7993292420985183,0.004993515273965262,0.03912720785647401,147,222,huber,13,COMPLETE
1,0.18573256417930467,2026-09-27 21:57:37.247297,2026-09-27 21:58:06.357196,0 days 00:00:29.109899,0.9162213204002109,0.9849549260809971,0.00892622738184373,0.05872031730223161,10,111,huber,9,COMPLETE
2,0.1853947708975665,2026-09-27 21:58:06.357382,2026-09-27 21:58:27.021299,0 days 00:00:20.663917,0.8059264473611898,0.645614570099021,0.004212412845262044,0.034496614656217915,48,65,huber,27,COMPLETE
3,0.18334798366155505,2026-09-27 21:58:27.021347,2026-09-27 22:00:06.636408,0 days 00:01:39.615061,0.7962072844310213,0.7571172192068059,0.0016142252267366923,0.04528156456471086,20,138,l1,28,COMPLETE
4,0.18470481098639396,2026-09-27 22:00:06.636592,2026-09-27 22:01:25.518280,0 days 00:01:18.881688,0.6523068845866853,0.9041986740582306,0.002737095165771331,0.022472426780406705,352,221,l1,37,COMPLETE
5,0.18464065339440933,2026-09-27 22:01:25.518483,2026-09-27 22:01:45.235729,0 days 00:00:19.717246,0.6293899908000085,0.954660201039391,0.9251083502214166,0.02488824083859974,11,60,huber,23,COMPLETE
6,0.18506035643534474,2026-09-27 22:01:45.235813,2026-09-27 22:01:56.809501,0 days 00:00:11.573688,0.9697494707820946,0.8875664116805573,10.144964926243942,0.05326639228158821,357,25,huber,14,COMPLETE
7,0.18305363700236543,2026-09-27 22:01:56.809539,2026-09-27 22:03:12.364404,0 days 00:01:15.554865,0.6943386448447411,0.6626651653816322,0.016400705022266843,0.02343638084696869,11,25,l1,63,COMPLETE
8,0.18350992132969512,2026-09-27 22:03:12.364575,2026-09-27 22:04:18.041276,0 days 00:01:05.676701,0.5372753218398854,0.9010984903770198,26.20670861087006,0.033085639673402445,16,69,l1,38,COMPLETE
9,0.18424425462008848,2026-09-27 22:04:18.041485,2026-09-27 22:05:53.598227,0 days 00:01:35.556742,0.8856351733429728,0.8645035840204937,0.002145393122543948,0.02019886832252484,134,150,l1,58,COMPLETE
